{
  "state_version": "v1",
  "state_type": "BiosphereState",
  "state_id": "biosphere-state-global-2026-08-03",
  "as_of": "2026-08-03",
  "world_model_ref": "SocioProphet/gaia-world-model@907f6b121134e6f49c1da69d51d91ec47f77648e",
  "carrying_capacity": {
    "read_ref": "gaia://biosphere/carrying_capacity/global@2026-08-03",
    "value_index": 0.83
  },
  "reserves": [
    {
      "stock": "reserve/hydrocarbon/basin-07",
      "read_ref": "gaia://biosphere/reserve/hydrocarbon/basin-07/floor@2026-08-03",
      "floor": 200,
      "current": 1000,
      "renewable": false
    },
    {
      "stock": "fishery/north-atlantic",
      "read_ref": "gaia://biosphere/fishery/north-atlantic/floor@2026-08-03",
      "floor": 100,
      "current": 500,
      "renewable": true
    }
  ],
  "regeneration_rates": [
    {
      "stock": "fishery/north-atlantic",
      "read_ref": "gaia://biosphere/fishery/north-atlantic/regeneration@2026-08-03",
      "rate": 0.05
    }
  ],
  "planetary_boundaries": [
    {"name": "biosphere_integrity", "stock": "fishery/north-atlantic", "threshold": 100, "status": "within"},
    {"name": "fossil_stock_depletion", "stock": "reserve/hydrocarbon/basin-07", "threshold": 200, "status": "at_risk"}
  ],
  "provenance": {"source": "gaia-world-model biosphere/resource state", "as_of": "2026-08-03"},
  "classification": {"sensitivity": "internal", "synthetic": true}
}
